{
  "version": 1,
  "config": {
    "seed": 4,
    "startMs": 0,
    "nodes": [
      {
        "id": "b",
        "machine": "duplicate-receiver",
        "initial": { "acted": false, "entropyRequested": false, "received": 0 }
      }
    ]
  },
  "trace": [
    {
      "t": "event",
      "node": "b",
      "event": { "kind": "transport/recv", "channel": "x", "source": "a", "payload": { "$bytes": "01" }, "at": 1 }
    },
    {
      "t": "event",
      "node": "b",
      "event": { "kind": "transport/recv", "channel": "x", "source": "a", "payload": { "$bytes": "01" }, "at": 1 }
    }
  ],
  "violation": {
    "oracle": "duplicate-delivery",
    "message": "receiver accepted duplicate delivery",
    "nodes": ["b"],
    "details": {
      "authoredBy": "model-strategy-compiler",
      "modelRequiredForReplay": false
    }
  }
}
